{
  "card_type": "model",
  "card_version": "model-card-v1",
  "package_version": "0.1.0",
  "owner": "forecasting",
  "reviewed_at": "2026-01-05",
  "artifact_versions": ["quantile_forecaster:0.1.0"],
  "metrics": [
    {
      "name": "empirical_coverage",
      "artifact_path": "reports/example_run/forecast_metrics.json",
      "artifact_field": "empirical_coverage"
    }
  ],
  "claims": [
    {
      "claim": "Forecast intervals are checked against held-out synthetic outcomes.",
      "evidence_type": "test",
      "reference": "tests/test_conformal.py"
    },
    {
      "claim": "Synthetic evaluation does not establish real retailer impact.",
      "evidence_type": "assumption",
      "reference": "synthetic_results_are_not_field_impact"
    }
  ],
  "assumptions": ["synthetic_results_are_not_field_impact"],
  "interface_names": ["ForecastDistribution", "QuantileForecaster"]
}
